{
  "schema_version": 1,
  "scope": "board_catalog_source_health",
  "as_of": "2026-10-07",
  "source_snapshot_file": "catalog/source_snapshots_2026-10-04.json",
  "thresholds": {
    "fresh_max_age_days": 14,
    "refresh_due_max_age_days": 30
  },
  "valid": true,
  "integrity_errors": [],
  "warnings": [
    "7 source-linked component(s) are refresh-due",
    "3 geometry reference(s) use visualization-only proxies"
  ],
  "summary": {
    "catalog_components": 37,
    "source_linked_components": 22,
    "planning_only_components": 15,
    "source_fresh": 15,
    "refresh_due": 7,
    "stale": 0,
    "missing_provenance": 0,
    "geometry_visual_proxies": 3,
    "source_snapshots": 18
  },
  "component_health": [
    {
      "component_id": "DONOR-COMP95",
      "label": "MBS Comp 95 donor board",
      "category": "base_board",
      "manufacturer": "MBS",
      "seller": "MBS",
      "procurement_state": "HOLD_MEASURE",
      "source_kind": "vendor",
      "source_url": "https://www.mbs.com/shop/p/comp-95-mountainboard-silver-hex",
      "snapshot_id": "mbs_comp95_2026_09_11",
      "verified_as_of": "2026-09-11",
      "age_days": 26,
      "status": "REFRESH_DUE",
      "reasons": [
        "source is 26 days old; refresh before relying on current stock or price"
      ]
    },
    {
      "component_id": "BRAKE-V5",
      "label": "MBS V5 mechanical brake system",
      "category": "brake",
      "manufacturer": "MBS",
      "seller": "MBS",
      "procurement_state": "HOLD_MEASURE",
      "source_kind": "vendor",
      "source_url": "https://www.mbs.com/shop/p/15006-mbs-v5-brake-system",
      "snapshot_id": "mbs_v5_2026_09_11",
      "verified_as_of": "2026-09-11",
      "age_days": 26,
      "status": "REFRESH_DUE",
      "reasons": [
        "source is 26 days old; refresh before relying on current stock or price"
      ]
    },
    {
      "component_id": "TRUCK-M3-400",
      "label": "Matrix III 400 mm / 50 mm axle reference",
      "category": "truck",
      "manufacturer": "MBS",
      "seller": "MBS",
      "procurement_state": "HOLD_MEASURE",
      "source_kind": "vendor",
      "source_url": "https://www.mbs.com/shop/parts/trucks/matrix-iii",
      "snapshot_id": "mbs_matrixiii_2026_09_11",
      "verified_as_of": "2026-09-11",
      "age_days": 26,
      "status": "REFRESH_DUE",
      "reasons": [
        "source is 26 days old; refresh before relying on current stock or price"
      ]
    },
    {
      "component_id": "TRUCK-M3-420-REF",
      "label": "Matrix III 420 mm / 70 mm drive-clearance reference",
      "category": "truck",
      "manufacturer": "MBS",
      "seller": "MBS",
      "procurement_state": "STUDY_ONLY",
      "source_kind": "repository_reference",
      "source_url": null,
      "snapshot_id": null,
      "verified_as_of": null,
      "age_days": null,
      "status": "PLANNING_ONLY",
      "reasons": []
    },
    {
      "component_id": "TRUCK-M3-440-STUDY",
      "label": "300 mm hanger + 70 mm axle coexistence study",
      "category": "truck",
      "manufacturer": "MBS",
      "seller": "MBS",
      "procurement_state": "STUDY_ONLY",
      "source_kind": "repository_reference",
      "source_url": null,
      "snapshot_id": null,
      "verified_as_of": null,
      "age_days": null,
      "status": "PLANNING_ONLY",
      "reasons": []
    },
    {
      "component_id": "HUB-RSII",
      "label": "MBS Rockstar II hub reference",
      "category": "hub",
      "manufacturer": "MBS",
      "seller": "MBS",
      "procurement_state": "HOLD_MEASURE",
      "source_kind": "vendor",
      "source_url": "https://www.mbs.com/shop/parts/wheels/hubs",
      "snapshot_id": "mbs_hubs_2026_09_11",
      "verified_as_of": "2026-09-11",
      "age_days": 26,
      "status": "REFRESH_DUE",
      "reasons": [
        "source is 26 days old; refresh before relying on current stock or price"
      ]
    },
    {
      "component_id": "TIRE-T1-8-REF",
      "label": "MBS T1 8-inch pneumatic reference",
      "category": "wheel",
      "manufacturer": "MBS",
      "seller": "MBS",
      "procurement_state": "SOURCE_ONLY",
      "source_kind": "repository_reference",
      "source_url": null,
      "snapshot_id": null,
      "verified_as_of": null,
      "age_days": null,
      "status": "PLANNING_ONLY",
      "reasons": []
    },
    {
      "component_id": "TIRE-T2-9",
      "label": "MBS T2 9-inch rollover study tire",
      "category": "wheel",
      "manufacturer": "MBS",
      "seller": "MBS",
      "procurement_state": "HOLD_MEASURE",
      "source_kind": "vendor",
      "source_url": "https://www.mbs.com/shop/p/13120-9-mbs-t2-tires-1",
      "snapshot_id": "mbs_t2_9_2026_09_11",
      "verified_as_of": "2026-09-11",
      "age_days": 26,
      "status": "REFRESH_DUE",
      "reasons": [
        "source is 26 days old; refresh before relying on current stock or price"
      ]
    },
    {
      "component_id": "AXLE-M3-70",
      "label": "Matrix III 70 mm axle set reference",
      "category": "axle",
      "manufacturer": "MBS",
      "seller": "MBS",
      "procurement_state": "HOLD_MEASURE",
      "source_kind": "vendor",
      "source_url": "https://www.mbs.com/shop/parts/trucks/matrix-iii",
      "snapshot_id": "mbs_matrixiii_2026_09_11",
      "verified_as_of": "2026-09-11",
      "age_days": 26,
      "status": "REFRESH_DUE",
      "reasons": [
        "source is 26 days old; refresh before relying on current stock or price"
      ]
    },
    {
      "component_id": "DRIVE-G1-DUAL",
      "label": "MBS G1 dual gear-drive reference",
      "category": "drive",
      "manufacturer": "MBS",
      "seller": "MBS",
      "procurement_state": "POWER_GATED",
      "source_kind": "vendor",
      "source_url": "https://www.mbs.com/shop/parts/electric-parts/gear-drives",
      "snapshot_id": "mbs_g1_2026_09_11",
      "verified_as_of": "2026-09-11",
      "age_days": 26,
      "status": "REFRESH_DUE",
      "reasons": [
        "source is 26 days old; refresh before relying on current stock or price"
      ]
    },
    {
      "component_id": "MOTOR-6374-CLASS",
      "label": "Sensored 6374-class motor placeholder",
      "category": "motor",
      "manufacturer": null,
      "seller": "Unknown",
      "procurement_state": "POWER_GATED",
      "source_kind": "planning_placeholder",
      "source_url": null,
      "snapshot_id": null,
      "verified_as_of": null,
      "age_days": null,
      "status": "PLANNING_ONLY",
      "reasons": []
    },
    {
      "component_id": "ESC-DUAL-CLASS",
      "label": "Dual VESC-class controller placeholder",
      "category": "esc",
      "manufacturer": null,
      "seller": "Unknown",
      "procurement_state": "POWER_GATED",
      "source_kind": "planning_placeholder",
      "source_url": null,
      "snapshot_id": null,
      "verified_as_of": null,
      "age_days": null,
      "status": "PLANNING_ONLY",
      "reasons": []
    },
    {
      "component_id": "BATTERY-TRAIL-CLASS",
      "label": "500-650 Wh professional trail-pack class",
      "category": "battery",
      "manufacturer": null,
      "seller": "Unknown",
      "procurement_state": "POWER_GATED",
      "source_kind": "planning_placeholder",
      "source_url": null,
      "snapshot_id": null,
      "verified_as_of": null,
      "age_days": null,
      "status": "PLANNING_ONLY",
      "reasons": []
    },
    {
      "component_id": "BATTERY-RANGE-CLASS",
      "label": "950-1150 Wh professional range-pack class",
      "category": "battery",
      "manufacturer": null,
      "seller": "Unknown",
      "procurement_state": "POWER_GATED",
      "source_kind": "planning_placeholder",
      "source_url": null,
      "snapshot_id": null,
      "verified_as_of": null,
      "age_days": null,
      "status": "PLANNING_ONLY",
      "reasons": []
    },
    {
      "component_id": "SNOWDECK-V01-CUSTOM",
      "label": "SnowDeck v0.1 adjustable rider-interface study",
      "category": "rider_interface",
      "manufacturer": "Worcester X1",
      "seller": "Worcester X1",
      "procurement_state": "STUDY_ONLY",
      "source_kind": "repository_reference",
      "source_url": null,
      "snapshot_id": null,
      "verified_as_of": null,
      "age_days": null,
      "status": "PLANNING_ONLY",
      "reasons": []
    },
    {
      "component_id": "TRAIL-ARMOR-STUDY",
      "label": "Sacrificial trail-armor study",
      "category": "armor",
      "manufacturer": "Worcester X1",
      "seller": "Worcester X1",
      "procurement_state": "STUDY_ONLY",
      "source_kind": "repository_reference",
      "source_url": null,
      "snapshot_id": null,
      "verified_as_of": null,
      "age_days": null,
      "status": "PLANNING_ONLY",
      "reasons": []
    },
    {
      "component_id": "PASSIVE-DOCK-STUDY",
      "label": "Passive charge-cradle alignment study",
      "category": "dock",
      "manufacturer": "Worcester X1",
      "seller": "Worcester X1",
      "procurement_state": "STUDY_ONLY",
      "source_kind": "repository_reference",
      "source_url": null,
      "snapshot_id": null,
      "verified_as_of": null,
      "age_days": null,
      "status": "PLANNING_ONLY",
      "reasons": []
    },
    {
      "component_id": "DECK-PRO-WARREN-REF",
      "label": "Pro Warren III 980 × 244 mm envelope reference",
      "category": "deck",
      "manufacturer": "MBS",
      "seller": "MBS",
      "procurement_state": "SOURCE_ONLY",
      "source_kind": "repository_reference",
      "source_url": null,
      "snapshot_id": null,
      "verified_as_of": null,
      "age_days": null,
      "status": "PLANNING_ONLY",
      "reasons": []
    },
    {
      "component_id": "DECK-AGENT-REF",
      "label": "Agent 1020 × 284 mm envelope reference",
      "category": "deck",
      "manufacturer": "MBS",
      "seller": "MBS",
      "procurement_state": "SOURCE_ONLY",
      "source_kind": "repository_reference",
      "source_url": null,
      "snapshot_id": null,